scale,scale_full,name_pref,subscale,items,value,values
PANAS,Positive and Negative Affect Scale,panas,Positive,"1, 3, 5, 9, 10, 12, 14, 16, 17, 19","Interested, Excited, Strong, Enthusiastic, Proud, Alert, Inspired, Determined, Attentive, Active","Very Slightly/Not at all, A little, Moderately, Quite a bit, Extremely"
PANAS,Positive and Negative Affect Scale,panas,Negative,"2, 4, 6, 7, 8, 11, 13, 15, 18, 20","Distressed, Upset, Guilty, Scared, Hostile, Irritable, Ashamed, Nervous, Jittery, Afraid","Very Slightly/Not at all, A little, Moderately, Quite a bit, Extremely"
BSS,Body Satisfaction Scale (State),bss,Single scale,"1, 2, 3, 4, 5, 6, 7, 8, 9, 10, 11, 12, 13, 14, 15, 16, 17","Whole Body, Head, Face, Jaw, Teeth, Nose, Mouth, Ears, Eyes, Shoulders, Neck, Chest, Tummy, Arms, Hands, Legs, Feet","Very dissatisfied, Moderately dissatisfied, Slightly dissatisfied, Undecided, Slightly satisfied, Moderately satisfied, Very satisfied"
SAC,Social Comparison,sac,Single scale,"1, 2, 3, 4",To what extent did you think overall about your appearance when viewing these images?</br>To what extent did you compare your overall appearance to the individuals in the Instagram images?</br>To what extent did you compare your stomach to the individuals in the Instagram images?</br>To what extent did you compare your thighs to the individuals in the Instagram images?,"Not at all, 2, 3, 4, A lot"
BAS,Body Appreciation Scale (Trait),bas,Single scale,"1, 2, 3, 4, 5, 6, 7, 8, 9, 10","I respect my body</br>I feel good about my body</br>I feel that my body has at least some good qualities</br>I take a positive attitude toward my body</br>I am tentative to my body's needs</br>I feel love for my body</br>I appreciate the different and unique characteristics of my body</br>My behaviour reveals my positive attitude toward my body: eg. I walk holding my head high and smiling</br>I am comfortable in my body</br>I feel like I am beautiful even if I am different from media images of attractive people eg. models, actresses","Never, Seldom, Sometimes, Often, Always"
PACSR,"Physical Appearance Comparison Scale, Revised",pacsr,Single scale,"1, 2, 3, 4","When I meet a new person (same sex), I compare my body size to their body size.</br>When I am out in public, I compare my body fat to the body fat of others.</br>When I am at a party, I compare my body shape to the body shape of others.</br>When I am out in public, I compare my body size to the body size of others","Never, Sometimes, About half the time, Most of the time, Always"
